{
  "$schema": "https://json-schema.org/draft/2020-12/schema",
  "title": "Digital Asset Control Boundary Validation",
  "type": "object",
  "required": [
    "schema_version",
    "artifact_id",
    "artifact_version",
    "assertions"
  ],
  "properties": {
    "schema_version": {
      "type": "string",
      "const": "v1"
    },
    "artifact_id": {
      "type": "string"
    },
    "artifact_version": {
      "type": "string"
    },
    "assertions": {
      "type": "array",
      "items": {
        "type": "object"
      }
    }
  },
  "additionalProperties": false
}
